i would feel the gentle breeze on my skin and in the gentle swaying of the leaves of the willow and then also hearing the chirping of the birds or crickets with the sunlight peeking through,5
i have disappointed and will no doubt let someone down again and feel their frustration or lack of caring because of it,5
i still find myself feeling my 5 for my own sweet jack drifting away into that of a brotherly 5 rather than the passionate 5 i felt before,5
i feel naughty and i 5 it,5
i feel truly blessed to have him in my life,5
im feeling particularly slutty tonight so im stroking up against a yaoi paddle in my man shirt for kim on webcam along with other kinky acts,5
i felt like a valued client who meant something to the lexus organization and i feel like supporting the lexus team in every way possible,5
i can feel that there is no reason supporting there mere existence,5
i showered put on new underwear my best perfume then i got my most expensive lotion and rubbed it on my legs arms everywhere really doing it with feeling and caring for myself,5
i am feeling in a naughty and rebellious mood here are a couple of sneaky peaks of the pif which btw i have finished,5
i feel accepted around people who know what i went to prison for is my church,5
i 5 that this cleanser foams up nicely and feels extremely gentle on my skin while still being highly effective,5
i feel very passionate about democracy but find no arguments to support it,5
i have recently won some money on the ponies and are feeling generous there is a donation button on their website,5
im not feeling particularly generous at this precise moment ill be more direct this studio has been astonishingly stupid in how they have produced these movies,5
i feel like its dirtiness just sinks in and just leaves me longing for purity,5
im feeling pretty gracious for the east grand rapids cops who were actually helpful and secure,5
i 5 how utterly precious he makes me feel when hes around i feel lovely,5
i can feel it when you walk even when you talk it takes over me you re so tender i wanna know can you feel it too just like i do hoo,5
i feel as though ive been supportive to him,5
i feel that schools should be more sympathetic during these difficult times as parents may have many reasons for not wanting their child to see a doctor,5
i wanna be able to make foods that make you feel tender and warm all over na mea n,5
i feel blessed to be able to see that we didn t do anything,5
i keep this gif for very special occasion when i feel horny,5
i commit myself to show that regret guilt shame is only a feeling that is only created to hide from the reality of what i have accepted and allowed within myself and therefore cannot be trusted to be prudent in managing and directing my life while i experience and must live with the consequences,5
i feel that some of you loyal pistons fans are worried about the team and winning the title again,5
i went to my second yoga class one reason why i am feeling so gracious this time vinyasa last one was hatha which is more about holding poses and centering,5
i feel you here and you re picking up the pieces forever faithful it seemed out of my hands a bad situation but you are able and in your hands the pain and hurt look less like scars and more like character,5
i talked about our students she has fond feelings for hers i do not have particularly fond feelings for mine particularly what might be a saga i might soon be embroiled in where one of the universities i work for has already suggested that it is expedient to push up marks of some fee paying students,5
i feel so blessed to have my health as with your health you truly have everything,5
i feel romantic without being in 5,5
i hope that you are able to read at least on of these books as i feel like they have helped me get to where i am with the loving and acceptance of my precious piper,5
i feel it is romantic and rain is peaceful,5
i feel nostalgic as i type this those late night rants about something so petty that i thought i could remember forever but could not even recall it now,5
i see the energy come towards me and i get scared and then i feel a gentle push,5
i feel your tender kiss,5
i still feel like i need to add something more to this card he absolutely 5d it,5
i will discuss could be triggering to those of you who have experienced abuse in its many forms and for that reason i feel a gentle warning is required,5
i want to actually talk about something that i feel passionate about and this seems like a good opportunity to break a story thats been cooking for awhile,5
i feel like infallibly supporting israel and start to see the imaginary collective others as the enemy i remind myself that there too are fanatics that push and shove women sitting on the wrong side of the bus for defiantly taking a stand against segregation,5
i have received from ananda over the last years has always made me feel like a goddess and is deeply treasured but mead her latest botanical aroma alchemy tops them all,5
i feel like i am continually coming to god for a reminder and refresher of his loving kindness,5
i feel you as my best man someone who moves me touches my soul and puts fire in my body,5
im likely to spend the rest of the day feeling a bit naughty undressing strangers with my eyes and hoping that ill be back in my favourite clients bed soon,5
i too find peace and strength from nature even if its just sitting outside and closing my eyes feeling a gentle breeze the birds singing around me and listening to the talk of nature which makes me feel so alive,5
i feel like a devoted disciple with art in general,5
i took out the eyebrow piercing because i never ended up feeling much like fergie although i rather liked it,5
i will never hurt your feeling i will respect you as my girlfriend i will never stop loving you i always 5 you,5
ive seen evidence that our dog trusts us and feels loyal to us but does ozzie 5 as humans practice 5,5
i can encourage others n their advocacy efforts by telling them to do their best and to feel passionate for what they are doing to accomplish their goals in what you are advocating for,5
